"DOMANDA";"risposta_uno";"risposta_due";"risposta_tre";"risposta_quattro";"CORRETTA"
"Dove nasce Leonardo da vinci?";"Firenze";"Vinci";"Anchiano";"Arezzo";"risposta_tre"
"A che anno e' attribuito il disegno dell'automa cavaliere?";1482;1495;1492;1489;"risposta_due"
"Leonardo concentra i suoi studi sull'automazione con lo scopo di?";"aumentare la produzione di cibo";"divertire la corte";"costruire armi";"migliorare la vita delle persone";"risposta_quattro"
"Leonardo disegna l'automa cavaliere per scopi?";"intrattenimento";"agricoli";"assistenza";"militari";"risposta_uno"
"In che anno muore Leonardo da Vinci? ";1512;1510;1528;1519;"risposta_quattro"
"Un mattone e una penna costano 1.10 euro in totale. Se il mattone costa 1 euro in piu' della penna, quanto costa la penna?";"10 centesimi";"5 centesimi";"20 centesimi";"15 centesimi";"risposta_due"
